<!ELEMENT poit (university*)>
<!ELEMENT university (name, passing, pages, location)>
<!ELEMENT name (#PCDATA)>
<!ELEMENT passing (#PCDATA)>
<!ELEMENT pages (#PCDATA)>
<!ELEMENT location (#PCDATA)>

